{
  "$schema": "https://json-schema.org/draft/2020-12/schema",
  "title": "Orbiter Ember Profile",
  "type": "object",
  "additionalProperties": false,
  "required": [
    "github",
    "bio",
    "skills"
  ],
  "properties": {
    "github": {
      "type": "string",
      "pattern": "^[A-Za-z0-9-]+$",
      "minLength": 1,
      "maxLength": 39
    },
    "name": {
      "type": "string",
      "minLength": 2,
      "maxLength": 80
    },
    "role": {
      "type": "string",
      "maxLength": 80
    },
    "avatar": {
      "type": "string",
      "format": "uri",
      "x-allowedSchemes": [
        "https"
      ]
    },
    "bio": {
      "type": "string",
      "minLength": 10,
      "maxLength": 240
    },
    "skills": {
      "type": "array",
      "minItems": 1,
      "maxItems": 12,
      "items": {
        "type": "string",
        "minLength": 1,
        "maxLength": 30
      }
    },
    "building": {
      "type": "string",
      "maxLength": 100
    },
    "links": {
      "type": "object",
      "additionalProperties": {
        "type": "string",
        "format": "uri",
        "x-allowedSchemes": [
          "https",
          "mailto"
        ]
      }
    },
    "projects": {
      "type": "array",
      "maxItems": 6,
      "items": {
        "type": "object",
        "additionalProperties": false,
        "required": [
          "name",
          "url"
        ],
        "properties": {
          "name": {
            "type": "string",
            "minLength": 1,
            "maxLength": 80
          },
          "url": {
            "type": "string",
            "format": "uri",
            "x-allowedSchemes": [
              "https"
            ]
          },
          "kind": {
            "type": "string",
            "maxLength": 40
          }
        }
      }
    },
    "joinedAt": {
      "type": "string",
      "pattern": "^\\d{4}-\\d{2}-\\d{2}$"
    },
    "isDemo": {
      "type": "boolean"
    }
  }
}
