{
  "name": "Rosellines",
  "github": "rosellines",
  "role": "Developer & Designer",
  "bio": "From Hero To AI.",
  "skills": [
    "JavaScript",
    "Open Source",
    "React",
    "Node.js",
    "Python",
    "Figma",
    "Adobe Photoshop",
    "Adobe Illustrator",
    "Adobe After Effects"

  ]
}