{
  "name": "Akira Demo",
  "github": "akira-demo",
  "role": "AI Interface Builder",
  "avatar": "https://avatars.githubusercontent.com/u/9919?v=4",
  "bio": "Designing expressive AI tools with tactile interfaces, fast feedback, and a little chaos.",
  "skills": [
    "AI",
    "TypeScript",
    "React",
    "Motion",
    "Open Source"
  ],
  "building": "an embodied AI dashboard",
  "links": {
    "GitHub": "https://github.com/akira-demo"
  },
  "projects": [
    {
      "name": "Ember AI UI",
      "url": "https://github.com/akira-demo",
      "kind": "Experiment"
    }
  ],
  "joinedAt": "2026-09-11",
  "isDemo": true
}
