{
  "name": "Maya Demo",
  "github": "maya-demo",
  "role": "Product Designer",
  "avatar": "https://avatars.githubusercontent.com/u/9919?v=4",
  "bio": "Turning rough product ideas into systems that are clear, expressive, and human.",
  "skills": [
    "UX",
    "Design Systems",
    "Figma",
    "Accessibility",
    "Open Source"
  ],
  "building": "a component playground",
  "links": {
    "GitHub": "https://github.com/maya-demo"
  },
  "projects": [
    {
      "name": "Soft UI Kit",
      "url": "https://github.com/maya-demo",
      "kind": "Design System"
    }
  ],
  "joinedAt": "2026-09-09",
  "isDemo": true
}
