{
  "name": "Ada Lovelace",
  "github": "ada-demo",
  "role": "Creative Technologist",
  "avatar": "https://avatars.githubusercontent.com/u/583231?v=4",
  "bio": "Building playful interfaces where code, motion and community collide.",
  "skills": [
    "JavaScript",
    "Design Systems",
    "Motion",
    "Open Source",
    "Accessibility"
  ],
  "building": "a tiny interaction engine",
  "links": {
    "GitHub": "https://github.com/ada-demo"
  },
  "projects": [
    {
      "name": "Ember Motion Kit",
      "url": "https://github.com/ada-demo",
      "kind": "Toolkit"
    }
  ],
  "joinedAt": "2026-09-05",
  "isDemo": true
}
