{
  "name": "Noah Demo",
  "github": "noah-demo",
  "role": "Full-Stack Engineer",
  "avatar": "https://avatars.githubusercontent.com/u/583231?v=4",
  "bio": "Shipping tiny tools that feel polished, useful, and slightly addictive to use.",
  "skills": [
    "Node.js",
    "Next.js",
    "PostgreSQL",
    "APIs",
    "Open Source"
  ],
  "building": "a collaborative dev notebook",
  "links": {
    "GitHub": "https://github.com/noah-demo"
  },
  "projects": [
    {
      "name": "Ember Notes",
      "url": "https://github.com/noah-demo",
      "kind": "Web App"
    }
  ],
  "joinedAt": "2026-09-10",
  "isDemo": true
}
